{
  "op": "txn.batchGet",
  "status": "OK",
  "seq": 0,
  "last": true,
  "items": [
    {
      "edgeAssessmentId": "3f0c9a2e-7d41-4b8e-9a51-0c2f6b1d7e44",
      "txnRef": "AUTH-2026-10-16-000981",
      "siteId": "acme-eu",
      "nodeId": "acme-eu-1",
      "evaluatedAt": "2026-10-16T09:14:07.412Z",
      "decision": "ALERT",
      "score": 45,
      "merchantId": "mrc_00421",
      "mcc": "5411",
      "amountMinor": 250000,
      "currency": "KES",
      "countryCode": "KE",
      "channel": "POS",
      "triggeredRuleIds": [
        1204,
        1311
      ],
      "ctrRequired": false,
      "sanctionsHit": false,
      "origin": "LIVE",
      "ruleVersionIds": [
        88012,
        88140
      ],
      "reasons": [
        "Card velocity above 10 transactions per hour",
        "High-value transaction at a grocery MCC"
      ],
      "bundleVersion": 37,
      "bundleHash": "sha256:75ac5ea64b7e41ec878c80aac05517a168e9a2f9671b623da95acc5d1b660676",
      "evaluator": "native",
      "latencyUs": 2875,
      "sanctionsHits": [],
      "typologyCodes": [
        "CARD_VELOCITY"
      ],
      "features": {
        "is_cross_border": false,
        "device_id": "dv-77a1",
        "pan_txn_count_1h": 11,
        "pan_amount_sum_24h": 18250.5,
        "customer_id": "cust-778812"
      },
      "legalHold": false
    }
  ],
  "missing": [
    "5a7b9c1d-3e5f-4a6b-9c8d-7e6f5a4b3c2d"
  ]
}
